"Listado de Expertos","Rama de conocimiento","Centro","Campus"
"EXPERTO PROPIO EN ITINERARIOS CULTURALES: DESARROLLO INTERNACIONAL/DESARROLLO LOCAL. SEMIPRESENCIAL (3ª Edición)","ARTES Y HUMANIDADES","DEPARTAMENTO HISTORIA DEL ARTE",""
"EXPERTO PROPIO EN ALERGIA A FÁRMACOS Y ALIMENTOS (1ª Edición)","CIENCIAS DE LA SALUD","FACULTAD DE MEDICINA","CENTRO"
"EXPERTO PROPIO EN ALERGIA A FÁRMACOS Y ALIMENTOS (1ª Edición)","CIENCIAS DE LA SALUD","FACULTAD DE MEDICINA SEVILLA",""
"EXPERTO PROPIO EN INVESTIGACIÓN FINANCIERA Y RECUPERACIÓN DE ACTIVOS (1ª Edición)","CIENCIAS SOCIALES Y JURÍDICAS","VIRTUAL",""
"EXPERTO EN TÉCNICAS DE SUPERVIVENCIA EN LA NATURALEZA MODULO FINAL (9ª Edición)","CIENCIAS","FACULTAD DE CIENCIAS DE LA ACTIVIDAD FÍSICA Y EL DEPORTE","CARTUJA"
