Cursos Complementarios,Rama de conocimiento,Centro,Campus
ADMINISTRACI흁 DE BASES DE DATOS ORACLE ,CIENCIAS,ESCUELA T텎NICA SUPERIOR DE INGENIER페S INFORM쳆ICA Y TELECOMUNICACI흁 ,FUENTENUEVA
C첿CULO INFORM쳆ICO DE PRESTACIONES DE LA SEGURIDAD SOCIAL, CC. SOCIALES Y JUR펛ICAS,FACULTAD DE DERECHO,CENTRO
COMPLEMENTOS DID첶TICOS Y TEOL휺ICOS PARA LA ERE EN EDUCACI흁 INFANTIL Y EDUCACI흁 PRIMARIA ,ARTES Y HUMANIDADES,FACULTAD DE CIENCIAS DE LA EDUCACI흁,CARTUJA
"
CURSO DE ESPECIALIZACI흁 EN ESTUDIOS ESTRAT텒ICOS Y SEGURIDAD INTERNACIONAL",CC. SOCIALES Y JUR펛ICAS,FACULTAD DE CC POL펪ICAS Y SOCIOLOG페,CENTRO
CURSO PUENTE DE ACCESO AL DIPLOMA DE DETECTIVE PRIVADO,CC. SOCIALES Y JUR펛ICAS,CENTRO ANDALUZ DE ESTUDIOS Y ENTRENAMIENTO,
DESARROLLO PROFESIONAL DE APLICACIONES CON VISUAL STUDIO ,INGENIER페 Y ARQUITECTURA,E.T.S. DE INGENIER페S INFORM쳆ICA Y TELECOMUNICACI흁,AYNADAMAR
DISE헲 Y ANIMACI흁 FLASH CON ACTIONSCRIPT ,ARTES Y HUMANIDADES,FACULTAD DE BELLAS ARTES,AYNADAMAR
DISE헲 Y MAQUETACI흁: DIBUJO VECTORIAL,ARTES Y HUMANIDADES,PALACIO DEL ALMIRANTE-ALBAIC펥 ,
DISE헲 Y PROGRAMACI흁 DE P첺INAS WEB,INGENIER페 Y ARQUITECTURA,FACULTAD DE CIENCIAS ,FUENTENUEVA
ESPECIALIZACI흁 EN CONTACTOLOG페,CC. DE LA SALUD,FACULTAD DE CIENCIAS,FUENTENUEVA
FOTODOCUMENTALISMO,ARTES Y HUMANIDADES,FACULTAD FILOSOF페 Y LETRAS,CARTUJA
ILUSTRACI흁 DIGITAL ,ARTES Y HUMANIDADES,FACULTAD DE BELLAS ARTES,AYNADAMAR
"INTRODUCCI흁 A ARCGIS: APLICACI흁 A LAS GEOCIENCIAS, AL MEDIO AMBIENTE Y A LA INGENIER페 CIVIL",INGENIER페 Y ARQUITECTURA,"E.T.S DE INGENIEROS DE CAMINOS, CANALES Y PUERTOS ",FUENTENUEVA
INTRODUCCI흁 AL DISE헲 Y C첿CULO DE ESTRUCTURAS DE EDIFICACI흁 CON MEDIOS INFORM쳆ICOS ,INGENIER페 Y ARQUITECTURA,E.T.S. DE INGENIER페 DE LA EDIFICACI흁,FUENTENUEVA
NTRODUCCI흁 AL DISE헲 Y DESARROLLO DE LA INVESTIGACI흁 CUALITATIVA ASISTIDA POR EL SOFTWARE NVIVO ,CC. SOCIALES Y JUR펛ICAS,FACULTAD DE CIENCIAS DE LA EDUCACI흁,CARTUJA
INTRODUCCI흁 AL PROTOCOLO Y LAS RELACIONES INSTITUCIONALES ,CC. SOCIALES Y JUR펛ICAS,FACULTAD DE CIENCIAS,FUENTENUEVA
"MONTAJE, CONFIGURACI흁 Y DIAGN흅TICO DE AVER페S EN EL PC ",INGENIER페 Y ARQUITECTURA,FACULTAD DE CIENCIAS ,FUENTENUEVA
PRINCIPIOS DE ANIMACI흁 CON ADOBE FLASH,ARTES Y HUMANIDADES,PALACIO DEL ALMIRANTE-ALBAIC펥 ,
PROGRAMACI흁 WEB 2.0: SERVICIOS INTERACTIVOS CON PHP Y MYSQL,CIENCIAS,E.T.S. DE INGENIER페S INFORM쳆ICA Y TELECOMUNICACI흁,AYNADAMAR
PROGRAMACI흁 WEB 2.0: DESARROLLO R쳃IDO DE APLICACIONES CON PYTHON Y DJANGO. ,INGENIER페 Y ARQUITECTURA,E.T.S. DE INGENIER페S INFORM쳆ICA Y TELECOMUNICACI흁,AYNADAMAR
T텎NICAS DE SUPERVIVENCIA EN LA NATURALEZA DESIERTO Y ZONAS RIDAS,ARTES Y HUMANIDADES,FACULTAD DE PSICOLOG페,CARTUJA
T텎NICAS DE SUPERVIVENCIA EN LA NATURALEZA "ALTA MONTA헤" ,CIENCIAS,FACULTAD DE PSICOLOG페,CARTUJA
T텎NICAS DE SUPERVIVENCIA EN LA NATURALEZA. MAR Y LITORAL ,CIENCIAS,FACULTAD DE PSICOLOG페,CARTUJA
T텎NICAS DE SUPERVIVENCIA EN LA NATURALEZA PRIMAVERA (BOSQUE) ,CIENCIAS,FACULTAD DE PSICOLOG페,CARTUJA
T텎NICAS DE DIAGN흅TICO APLICADAS A LA CONSERVACI흁 DE LOS MATERIALES DE CONSTRUCCI흁 DE LOS EDIFICIOS HISTRICOS ,INGENIER페 Y ARQUITECTURA,FACULTAD DE CIENCIAS,FUENTENUEVA
TRAVEL WITH ENGLISH: INGL텝 SITUACIONAL PR첶TICO,CC. SOCIALES Y JUR펛ICAS,FACULTAD DE CIENCIAS DE LA EDUCACI흁,CARTUJA
UTILIZACI흁 DEL NVIVO EN LA INVESTIGACI흁 APLICADA A LAS CIENCIAS SOCIALES ESTRAT텒ICAS PARA EL AN첿ISIS DE INFORMACI흁 CUALITATIVA ,CC. SOCIALES Y JUR펛ICAS,FACULTAD DE CIENCIAS DE LA EDUCACI흁,CARTUJA
CURSO B쳅ICO SOBRE DROGODEPENDENCIAS ,CC. DE LA SALUD,CENTRO PROVINCIAL DE DROGODEPENDENCIAS,
