C휷IGO,TITULO,TASA RENDIMIENTO,TASA EXITO
200,GRADUADO/A EN BIOLOG페,"66,56","75,84"
201,GRADO EN ODONTOLOG페,"88,11","93,19"
202,GRADUADO/A EN NUTRICI흁 HUMANA Y DIET텞ICA,"85,21","91,59"
203,GRADUADO/A EN CIENCIA Y TECNOLOG페 DE LOS ALIMENTOS,"58,87","70,87"
204,GRADUADO/A EN FARMACIA,"64,45","75,03"
205,GRADUADO/A EN INGENIER페 ELECTR흁ICA INDUSTRIAL,"53,88","65,84"
206,GRADUADO/A EN CIENCIAS AMBIENTALES,"54,03","68,52"
207,GRADUADO/A EN ENFERMER페,"88,25","94,51"
208,GRADUADO/A EN GEOGRAF페 Y GESTI흁 DEL TERRITORIO,"60,46","69,61"
209,GRADUADO/A EN ARQUITECTURA,"61,73","74,14"
210,GRADO EN INGENIER페 EN EDIFICACI흁 (CURSO PUENTE),"86,67","96,3"
212,GRADUADO/A EN CIENCIAS POL펪ICAS Y DE LA ADMINISTRACI흁,"55,55","70,53"
213,GRADUADO/A EN CIENCIAS POL펪ICAS Y DE LA ADMINIST. Y DERECHO,"69,4","81,45"
214,GRADUADO/A EN SOCIOLOG페,"66,78","78,55"
220,GRADUADO/A EN INGENIER페 QU펤ICA,"53,85","65,99"
221,GRADUADO/A EN INGENIER페 DE TECNOLOG페S DE TELECOMUNICACI흁,"66,9","75,88"
222,GRADUADO/A EN MEDICINA,"92,48","95,87"
223,GRADUADO/A EN ESTAD펩TICA,"43,33",59
227,GRADUADO/A EN COMUNICACI흁 AUDIOVISUAL,"94,48","97,48"
228,GRADUADO/A EN ADMINISTRACI흁 Y DIRECCI흁 DE EMPRESAS-DERECHO,"81,67","87,95"
230,GRADUADO/A EN EDIFICACI흁,"57,23","74,51"
231,GRADUADO/A EN INFORMACI흁 Y DOCUMENTACI흁,"72,7","80,98"
233,GRADUADO/A EN FINANZAS Y CONTABILIDAD,"73,18","79,64"
235,GRADUADO/A EN ADMINISTRACI흁 Y DIRECCI흁 DE EMPRESAS,"75,64","82,58"
236,GRADUADO/A EN MARKETING E INVESTIGACI흁 DE MERCADOS,"66,03","73,47"
237,GRADUADO/A EN INGENIER페 CIVIL,"55,76","71,17"
238,GRADUADO/A EN TURISMO,"79,86","86,68"
239,GRADUADO/A EN ECONOM페,61,"71,19"
241,GRADUADO/A EN FISIOTERAPIA,"88,85","94,98"
242,GRADUADO/A EN DERECHO,"63,67","74,43"
243,GRADUADO/A EN TERAPIA OCUPACIONAL,"88,52","94,62"
244,GRADUADO/A EN EDUCACI흁 SOCIAL,"93,58","96,74"
249,GRADUADO/A EN TRABAJO SOCIAL,"91,2","95,06"
252,GRADUADO/A EN TRADUCCI흁 E INTERPRETACI흁,"85,5","92,65"
256,GRADUADO/A EN EDUCACI흁 PRIMARIA (BILING㏊),"85,92","89,7"
257,GRADUADO/A EN EDUCACI흁 PRIMARIA,"87,24","91,85"
258,GRADUADO/A EN EDUCACI흁 INFANTIL,"94,33","97,07"
259,GRADUADO/A EN RELACIONES LABORALES Y RECURSOS HUMANOS,"64,36","76,63"
260,GRADUADO/A EN BELLAS ARTES,"87,01","94,9"
261,GRADUADO/A EN BIOQU펤ICA,"86,33","90,24"
263,GRADUADO/A EN FILOSOF페,"54,93","79,98"
264,GRADUADO/A EN PSICOLOG페,"81,9","88,76"
265,GRADUADO/A EN CONSERVACI흁 Y RESTAURACI흁 DE BIENES CULTURAL,"84,54","93,57"
267,GRADUADO/A EN F펩ICA,"49,06","69,54"
268,GRADUADO/A EN GEOLOG페,"53,42","66,83"
270,GRADUADO/A EN MATEM쳆ICAS,"57,49","70,75"
273,GRADUADO/A EN LENGUAS MODERNAS Y SUS LITERATURAS,"80,13","89,32"
276,GRADUADO/A EN FILOLOG페 CL쳅ICA,"63,13","75,4"
277,GRADUADO/A EN ESTUDIOS FRANCESES,"65,04","75,72"
279,GRADUADO/A EN ESTUDIOS RABES E ISL쳀ICOS,"57,94","81,47"
283,GRADUADO/A EN FILOLOG페 HISP쳁ICA,"82,82","90,8"
285,GRADUADO/A EN ESTUDIOS INGLESES,"72,42","81,95"
286,GRADUADO/A EN LOGOPEDIA,"86,83","91,6"
287,GRADUADO/A EN 흃TICA Y OPTOMETR페,"63,69","70,75"
288,GRADUADO/A EN CIENCIAS DE LA ACTIVIDAD F펩ICA Y DEL DEPORTE,"88,21","92,48"
290,GRADUADO/A EN LITERATURAS COMPARADAS,"71,43","88,04"
291,GRADUADO/A EN QU펤ICA,"53,72","70,4"
292,GRADUADO/A EN HISTORIA,"63,6","80,37"
293,GRADUADO/A EN HISTORIA DEL ARTE,"63,27","77,31"
294,GRADUADO/A EN ANTROPOLOG페 SOCIAL Y CULTURAL,"75,09","84,83"
296,GRADUADO/A EN INGENIER페 INFORM쳆ICA,"38,01","54,58"
297,GRADUADO/A EN INGENIER페 INFORM쳆ICA Y MATEM쳆ICAS,"49,11","61,54"
298,GRADUADO/A EN PEDAGOG페,"85,91","91,24"
299,GRADUADO/A EN HISTORIA Y CIENCIAS DE LA MＣICA,"62,92","79,29"
407,GRADUADO/A EN ENFERMER페 (CEUTA),"72,61","78,77"
414,GRADUADO/A EN EDUCACI흁 SOCIAL (CEUTA),"76,2","88,46"
433,GRADUADO/A EN ADMINISTRACI흁 Y DIRECCI흁 DE EMPRESAS (CEUTA),"72,15","84,07"
457,GRADUADO/A EN EDUCACI흁 PRIMARIA (CEUTA),"66,96","77,05"
458,GRADUADO/A EN EDUCACI흁 INFANTIL (CEUTA),"78,69","85,88"
496,GRADUADO/A EN INGENIER페 INFORM쳆ICA (CEUTA),"46,1","65,14"
507,GRADUADO/A EN ENFERMER페 (MELILLA),"85,37","87,65"
514,GRADUADO/A EN EDUCACI흁 SOCIAL (MELILLA),"76,32","85,35"
533,GRADUADO EN ADMINISTRACI흁 Y DIRECCI흁 DE EMPRESAS (MELILLA),"50,32","75,34"
535,DIPLOMADO EN CIENCIAS EMPRESARIALES (MELILLA),"52,27","81,4"
537,DIPLOMADO EN RELACIONES LABORALES (MELILLA),"47,63","83,57"
538,DIPLOMADO EN GESTI흁 Y ADMINISTRACI흁 P２LICA (MELILLA),"56,49","87,27"
539,GRADUADO/A EN GESTI흁 Y ADMINISTRACI흁 P２LICA (MELILLA),"64,17",77
557,GRADUADO/A EN EDUCACI흁 PRIMARIA (MELILLA),"68,87","78,56"
558,GRADUADO/A EN EDUCACI흁 INFANTIL (MELILLA),"77,32","84,41"
559,GRADUADO/A EN RELACIONES LABORALES Y RECURSOS HUMANOS (MEL.),"64,97","82,73"
