T펪ULO,TASA RENDIMIENTO,TASA 텢ITO
GRADUADO/A EN BIOLOG페,"66,56","75,84"
GRADO EN ODONTOLOG페,"88,11","93,19"
GRADUADO/A EN NUTRICI흁 HUMANA Y DIET텞ICA,"85,21","91,59"
GRADUADO/A EN CIENCIA Y TECNOLOG페 DE LOS ALIMENTOS,"58,87","70,87"
GRADUADO/A EN FARMACIA,"64,45","75,03"
GRADUADO/A EN INGENIER페 ELECTR흁ICA INDUSTRIAL,"53,88","65,84"
GRADUADO/A EN CIENCIAS AMBIENTALES,"54,03","68,52"
GRADUADO/A EN ENFERMER페,"88,25","94,51"
GRADUADO/A EN GEOGRAF페 Y GESTI흁 DEL TERRITORIO,"60,46","69,61"
GRADUADO/A EN ARQUITECTURA,"61,73","74,14"
GRADO EN INGENIER페 EN EDIFICACI흁 (CURSO PUENTE),"86,67","96,3"
GRADUADO/A EN CIENCIAS POL펪ICAS Y DE LA ADMINISTRACI흁,"55,55","70,53"
GRADUADO/A EN CIENCIAS POL펪ICAS Y DE LA ADMINIST. Y DERECHO,"69,4","81,45"
GRADUADO/A EN SOCIOLOG페,"66,78","78,55"
GRADUADO/A EN INGENIER페 QU펤ICA,"53,85","65,99"
GRADUADO/A EN INGENIER페 DE TECNOLOG페S DE TELECOMUNICACI흁,"66,9","75,88"
GRADUADO/A EN MEDICINA,"92,48","95,87"
GRADUADO/A EN ESTAD펩TICA,"43,33",59
GRADUADO/A EN COMUNICACI흁 AUDIOVISUAL,"94,48","97,48"
GRADUADO/A EN ADMINISTRACI흁 Y DIRECCI흁 DE EMPRESAS-DERECHO,"81,67","87,95"
GRADUADO/A EN EDIFICACI흁,"57,23","74,51"
GRADUADO/A EN INFORMACI흁 Y DOCUMENTACI흁,"72,7","80,98"
GRADUADO/A EN FINANZAS Y CONTABILIDAD,"73,18","79,64"
GRADUADO/A EN ADMINISTRACI흁 Y DIRECCI흁 DE EMPRESAS,"75,64","82,58"
GRADUADO/A EN MARKETING E INVESTIGACI흁 DE MERCADOS,"66,03","73,47"
GRADUADO/A EN INGENIER페 CIVIL,"55,76","71,17"
GRADUADO/A EN TURISMO,"79,86","86,68"
GRADUADO/A EN ECONOM페,61,"71,19"
GRADUADO/A EN FISIOTERAPIA,"88,85","94,98"
GRADUADO/A EN DERECHO,"63,67","74,43"
GRADUADO/A EN TERAPIA OCUPACIONAL,"88,52","94,62"
GRADUADO/A EN EDUCACI흁 SOCIAL,"93,58","96,74"
GRADUADO/A EN TRABAJO SOCIAL,"91,2","95,06"
GRADUADO/A EN TRADUCCI흁 E INTERPRETACI흁,"85,5","92,65"
GRADUADO/A EN EDUCACI흁 PRIMARIA (BILING㏊),"85,92","89,7"
GRADUADO/A EN EDUCACI흁 PRIMARIA,"87,24","91,85"
GRADUADO/A EN EDUCACI흁 INFANTIL,"94,33","97,07"
GRADUADO/A EN RELACIONES LABORALES Y RECURSOS HUMANOS,"64,36","76,63"
GRADUADO/A EN BELLAS ARTES,"87,01","94,9"
GRADUADO/A EN BIOQU펤ICA,"86,33","90,24"
GRADUADO/A EN FILOSOF페,"54,93","79,98"
GRADUADO/A EN PSICOLOG페,"81,9","88,76"
GRADUADO/A EN CONSERVACI흁 Y RESTAURACI흁 DE BIENES CULTURAL,"84,54","93,57"
GRADUADO/A EN F펩ICA,"49,06","69,54"
GRADUADO/A EN GEOLOG페,"53,42","66,83"
GRADUADO/A EN MATEM쳆ICAS,"57,49","70,75"
GRADUADO/A EN LENGUAS MODERNAS Y SUS LITERATURAS,"80,13","89,32"
GRADUADO/A EN FILOLOG페 CL쳅ICA,"63,13","75,4"
GRADUADO/A EN ESTUDIOS FRANCESES,"65,04","75,72"
GRADUADO/A EN ESTUDIOS RABES E ISL쳀ICOS,"57,94","81,47"
GRADUADO/A EN FILOLOG페 HISP쳁ICA,"82,82","90,8"
GRADUADO/A EN ESTUDIOS INGLESES,"72,42","81,95"
GRADUADO/A EN LOGOPEDIA,"86,83","91,6"
GRADUADO/A EN 흃TICA Y OPTOMETR페,"63,69","70,75"
GRADUADO/A EN CIENCIAS DE LA ACTIVIDAD F펩ICA Y DEL DEPORTE,"88,21","92,48"
GRADUADO/A EN LITERATURAS COMPARADAS,"71,43","88,04"
GRADUADO/A EN QU펤ICA,"53,72","70,4"
GRADUADO/A EN HISTORIA,"63,6","80,37"
GRADUADO/A EN HISTORIA DEL ARTE,"63,27","77,31"
GRADUADO/A EN ANTROPOLOG페 SOCIAL Y CULTURAL,"75,09","84,83"
GRADUADO/A EN INGENIER페 INFORM쳆ICA,"38,01","54,58"
GRADUADO/A EN INGENIER페 INFORM쳆ICA Y MATEM쳆ICAS,"49,11","61,54"
GRADUADO/A EN PEDAGOG페,"85,91","91,24"
GRADUADO/A EN HISTORIA Y CIENCIAS DE LA MＣICA,"62,92","79,29"
GRADUADO/A EN ENFERMER페 (CEUTA),"72,61","78,77"
GRADUADO/A EN EDUCACI흁 SOCIAL (CEUTA),"76,2","88,46"
GRADUADO/A EN ADMINISTRACI흁 Y DIRECCI흁 DE EMPRESAS (CEUTA),"72,15","84,07"
GRADUADO/A EN EDUCACI흁 PRIMARIA (CEUTA),"66,96","77,05"
GRADUADO/A EN EDUCACI흁 INFANTIL (CEUTA),"78,69","85,88"
GRADUADO/A EN INGENIER페 INFORM쳆ICA (CEUTA),"46,1","65,14"
GRADUADO/A EN ENFERMER페 (MELILLA),"85,37","87,65"
GRADUADO/A EN EDUCACI흁 SOCIAL (MELILLA),"76,32","85,35"
GRADUADO EN ADMINISTRACI흁 Y DIRECCI흁 DE EMPRESAS (MELILLA),"50,32","75,34"
DIPLOMADO EN CIENCIAS EMPRESARIALES (MELILLA),"52,27","81,4"
DIPLOMADO EN RELACIONES LABORALES (MELILLA),"47,63","83,57"
DIPLOMADO EN GESTI흁 Y ADMINISTRACI흁 P２LICA (MELILLA),"56,49","87,27"
GRADUADO/A EN GESTI흁 Y ADMINISTRACI흁 P２LICA (MELILLA),"64,17",77
GRADUADO/A EN EDUCACI흁 PRIMARIA (MELILLA),"68,87","78,56"
GRADUADO/A EN EDUCACI흁 INFANTIL (MELILLA),"77,32","84,41"
GRADUADO/A EN RELACIONES LABORALES Y RECURSOS HUMANOS (MEL.),"64,97","82,73"
