C휷IGO,TITULO,TASA RENDIMIENTO,TASA EXITO,TASA ABANDONO INICIAL
200,GRADUADO/A EN BIOLOG페,"72,25","79,94","13,18"
201,GRADO EN ODONTOLOG페,"87,19","91,78","12,66"
202,GRADUADO/A EN NUTRICI흁 HUMANA Y DIET텞ICA,"87,01","90,95","8,08"
203,GRADUADO/A EN CIENCIA Y TECNOLOG페 DE LOS ALIMENTOS,"76,54","81,49",
204,GRADUADO/A EN FARMACIA,"65,83","75,67","10,49"
205,GRADUADO/A EN INGENIER페 ELECTR흁ICA INDUSTRIAL,"57,92","72,43",
206,GRADUADO/A EN CIENCIAS AMBIENTALES,"56,33","68,33","27,82"
207,GRADUADO/A EN ENFERMER페,"91,87","95,86","14,4"
208,GRADUADO/A EN GEOGRAF페 Y GESTI흁 DEL TERRITORIO,"64,68","76,71","27,27"
209,GRADUADO/A EN ARQUITECTURA,"65,29","79,62","16,03"
210,GRADO EN INGENIER페 EN EDIFICACI흁 (CURSO PUENTE),"81,96","93,08",
212,GRADUADO/A EN CIENCIAS POL펪ICAS Y DE LA ADMINISTRACI흁,"65,94","78,37","31,76"
213,GRADUADO/A EN CIENCIAS POL펪ICAS Y DE LA ADMINIST. Y DERECHO,"73,76","83,22","27,27"
214,GRADUADO/A EN SOCIOLOG페,"73,11","82,94","34,09"
220,GRADUADO/A EN INGENIER페 QU펤ICA,"60,58","70,46","32,43"
221,GRADUADO/A EN INGENIER페 DE TECNOLOG페S DE TELECOMUNICACI흁,"71,59","81,01","15,05"
222,GRADUADO/A EN MEDICINA,"92,67","95,35","2,89"
223,GRADUADO/A EN ESTAD펩TICA,"55,33","67,73","45,9"
227,GRADUADO/A EN COMUNICACI흁 AUDIOVISUAL,"93,05","95,98","10,77"
228,GRADUADO/A EN ADMINISTRACI흁 Y DIRECCI흁 DE EMPRESAS-DERECHO,"82,95","87,98","13,04"
230,GRADUADO/A EN EDIFICACI흁,"60,29","74,1","13,24"
231,GRADUADO/A EN INFORMACI흁 Y DOCUMENTACI흁,"78,75","86,64","27,94"
233,GRADUADO/A EN FINANZAS Y CONTABILIDAD,"67,77","74,1","8,8"
235,GRADUADO/A EN ADMINISTRACI흁 Y DIRECCI흁 DE EMPRESAS,"75,65","81,28","7,2"
236,GRADUADO/A EN MARKETING E INVESTIGACI흁 DE MERCADOS,"73,69","78,91","10,08"
237,GRADUADO/A EN INGENIER페 CIVIL,"61,61","74,69","7,49"
238,GRADUADO/A EN TURISMO,"84,45","89,55","11,85"
239,GRADUADO/A EN ECONOM페,"65,24","74,03","15,06"
241,GRADUADO/A EN FISIOTERAPIA,"90,9","96,11","7,84"
242,GRADUADO/A EN DERECHO,"67,74","78,14","10,63"
243,GRADUADO/A EN TERAPIA OCUPACIONAL,"92,7","95,58","12,07"
244,GRADUADO/A EN EDUCACI흁 SOCIAL,"93,67","96,04","5,69"
245,GRADUADO/A EN CRIMINOLOG페,"91,2","96,26",
249,GRADUADO/A EN TRABAJO SOCIAL,"91,12","94,58","9,66"
252,GRADUADO/A EN TRADUCCI흁 E INTERPRETACI흁,"84,42","91,36","6,75"
256,GRADUADO/A EN EDUCACI흁 PRIMARIA (BILING㏊),"93,38","95,27",
257,GRADUADO/A EN EDUCACI흁 PRIMARIA,"90,4","93,26","8,63"
258,GRADUADO/A EN EDUCACI흁 INFANTIL,"95,96","97,82","9,34"
259,GRADUADO/A EN RELACIONES LABORALES Y RECURSOS HUMANOS,"72,75","80,81","17,33"
260,GRADUADO/A EN BELLAS ARTES,"85,22","94,91","13,51"
261,GRADUADO/A EN BIOQU펤ICA,"90,83","92,91","14,29"
263,GRADUADO/A EN FILOSOF페,"69,79","84,43","33,33"
264,GRADUADO/A EN PSICOLOG페,"83,2","88,43","6,64"
265,GRADUADO/A EN CONSERVACI흁 Y RESTAURACI흁 DE BIENES CULTURAL,"87,76","94,28","13,21"
267,GRADUADO/A EN F펩ICA,"56,63","74,73","26,25"
268,GRADUADO/A EN GEOLOG페,"53,08","65,31","38,24"
270,GRADUADO/A EN MATEM쳆ICAS,"64,39","76,24","33,33"
273,GRADUADO/A EN LENGUAS MODERNAS Y SUS LITERATURAS,"79,01","88,75","21,05"
276,GRADUADO/A EN FILOLOG페 CL쳅ICA,"72,4","82,47","47,37"
277,GRADUADO/A EN ESTUDIOS FRANCESES,"68,24","79,28","31,43"
279,GRADUADO/A EN ESTUDIOS RABES E ISL쳀ICOS,"73,5","86,63","35,48"
283,GRADUADO/A EN FILOLOG페 HISP쳁ICA,"79,14","88,95","26,09"
285,GRADUADO/A EN ESTUDIOS INGLESES,"75,06","83,71","11,43"
286,GRADUADO/A EN LOGOPEDIA,"93,71","94,32","25,81"
287,GRADUADO/A EN 흃TICA Y OPTOMETR페,"66,39","71,3","9,17"
288,GRADUADO/A EN CIENCIAS DE LA ACTIVIDAD F펩ICA Y DEL DEPORTE,"85,82","91,07","9,24"
290,GRADUADO/A EN LITERATURAS COMPARADAS,"67,8","86,69","40,63"
291,GRADUADO/A EN QU펤ICA,"56,67","70,48","20,51"
292,GRADUADO/A EN HISTORIA,"73,33","85,6","23,03"
293,GRADUADO/A EN HISTORIA DEL ARTE,"70,73","82,81","29,29"
294,GRADUADO/A EN ANTROPOLOG페 SOCIAL Y CULTURAL,"74,23","85,21",
296,GRADUADO/A EN INGENIER페 INFORM쳆ICA,"50,99","68,19","30,97"
297,GRADUADO/A EN INGENIER페 INFORM쳆ICA Y MATEM쳆ICAS,"57,98","71,77",
298,GRADUADO/A EN PEDAGOG페,"92,87","96,14","16,39"
299,GRADUADO/A EN HISTORIA Y CIENCIAS DE LA MＣICA,"74,58","86,36","26,67"
407,GRADUADO/A EN ENFERMER페 (CEUTA),"81,92","87,73","19,26"
414,GRADUADO/A EN EDUCACI흁 SOCIAL (CEUTA),"84,4","90,55",
433,GRADUADO/A EN ADMINISTRACI흁 Y DIRECCI흁 DE EMPRESAS (CEUTA),"77,98","86,07","30,56"
457,GRADUADO/A EN EDUCACI흁 PRIMARIA (CEUTA),"78,2","86,24","25,74"
458,GRADUADO/A EN EDUCACI흁 INFANTIL (CEUTA),"84,31","90,99","26,42"
496,GRADUADO/A EN INGENIER페 INFORM쳆ICA (CEUTA),"45,91","65,16","44,44"
507,GRADUADO/A EN ENFERMER페 (MELILLA),"86,87","88,9","6,67"
514,GRADUADO/A EN EDUCACI흁 SOCIAL (MELILLA),"80,52","85,48",
533,GRADUADO EN ADMINISTRACI흁 Y DIRECCI흁 DE EMPRESAS (MELILLA),"61,02","76,05","41,18"
535,DIPLOMADO EN CIENCIAS EMPRESARIALES (MELILLA),"35,4","70,89",
537,DIPLOMADO EN RELACIONES LABORALES (MELILLA),"31,47",100,
538,DIPLOMADO EN GESTI흁 Y ADMINISTRACI흁 P２LICA (MELILLA),"7,13","26,56",
539,GRADUADO/A EN GESTI흁 Y ADMINISTRACI흁 P２LICA (MELILLA),"78,39","88,14","86,67"
557,GRADUADO/A EN EDUCACI흁 PRIMARIA (MELILLA),"69,89","76,9","27,27"
558,GRADUADO/A EN EDUCACI흁 INFANTIL (MELILLA),"83,58","87,71","29,27"
559,GRADUADO/A EN RELACIONES LABORALES Y RECURSOS HUMANOS (MEL.),"68,38","87,46","33,33"
