RAMAS,TITULACIÓN,Hombres,Mujeres,TOTAL
Universidad de Granada, ,24762,29768,54530
,,,,
ARTES Y HUMANIDADES,GRADUADO/A EN ARQUEOLOGÍA,18,41,59
 ,GRADUADO/A EN BELLAS ARTES,364,550,914
 ,GRADUADO/A EN CONSERVACIÓN Y RESTAURACIÓN DE BIENES CULTURAL,39,131,170
 ,GRADUADO/A EN ESTUDIOS ÁRABES E ISLÁMICOS,57,71,128
 ,GRADUADO/A EN ESTUDIOS FRANCESES,56,160,216
 ,GRADUADO/A EN ESTUDIOS INGLESES,194,372,566
 ,GRADUADO/A EN FILOLOGÍA CLÁSICA,45,82,127
 ,GRADUADO/A EN FILOLOGÍA HISPÁNICA,274,209,483
 ,GRADUADO/A EN FILOSOFÍA,148,75,223
 ,GRADUADO/A EN HISTORIA,402,138,540
 ,GRADUADO/A EN HISTORIA DEL ARTE,152,291,443
 ,GRADUADO/A EN HISTORIA Y CIENCIAS DE LA MÚSICA,131,90,221
 ,GRADUADO/A EN LENGUAS MODERNAS Y SUS LITERATURAS,174,209,383
 ,GRADUADO/A EN LITERATURAS COMPARADAS,56,71,127
 ,GRADUADO/A EN TRADUCCIÓN E INTERPRETACIÓN,287,1002,1289
 ,LICENCIADO EN ANTROPOLOGÍA SOCIAL Y CULTURAL,24,45,69
 ,LICENCIADO EN BELLAS ARTES,103,154,257
 ,LICENCIADO EN FILOLOGÍA ÁRABE,10,17,27
 ,LICENCIADO EN FILOLOGÍA CLÁSICA,13,17,30
 ,LICENCIADO EN FILOLOGÍA ESLAVA,7,8,15
 ,LICENCIADO EN FILOLOGÍA FRANCESA,16,33,49
 ,LICENCIADO EN FILOLOGÍA HISPÁNICA,46,72,118
 ,LICENCIADO EN FILOLOGÍA INGLESA,62,166,228
 ,LICENCIADO EN FILOLOGÍA ITALIANA,,1,1
 ,LICENCIADO EN FILOLOGÍA ROMÁNICA,3,4,7
 ,LICENCIADO EN FILOSOFÍA,53,35,88
 ,LICENCIADO EN GEOGRAFÍA,37,14,51
 ,LICENCIADO EN HISTORIA,137,69,206
 ,LICENCIADO EN HISTORIA DEL ARTE,62,131,193
 ,LICENCIADO EN HISTORIA Y CIENCIAS DE LA MUSICA,16,14,30
 ,LICENCIADO EN TEORÍA DE LA LITERATURA Y LITERATURA COMPARADA,16,8,24
 ,LICENCIADO EN TRADUCCIÓN E INTERPRETACIÓN,62,206,268
TOTAL RAMA, ,3064,4486,7550
CIENCIAS EXPERIMENTALES,DIPLOMADO EN ESTADÍSTICA,5,11,16
 ,DIPLOMADO EN NUTRICIÓN HUMANA Y DIETÉTICA,5,25,30
 ,DIPLOMADO EN ÓPTICA Y OPTOMETRÍA,14,32,46
 ,GRADUADO/A EN BIOLOGÍA,420,479,899
 ,GRADUADO/A EN BIOQUÍMICA,66,120,186
 ,GRADUADO/A EN CIENCIA Y TECNOLOGÍA DE LOS ALIMENTOS,64,109,173
 ,GRADUADO/A EN CIENCIAS AMBIENTALES,288,173,461
 ,GRADUADO/A EN ESTADÍSTICA,80,60,140
 ,GRADUADO/A EN FÍSICA,245,75,320
 ,GRADUADO/A EN GEOLOGÍA,132,65,197
 ,GRADUADO/A EN MATEMÁTICAS,188,146,334
 ,GRADUADO/A EN ÓPTICA Y OPTOMETRÍA,134,296,430
 ,GRADUADO/A EN QUÍMICA,157,140,297
 ,LICENCIADO EN BIOLOGÍA,152,260,412
 ,LICENCIADO EN BIOQUÍMICA,17,25,42
 ,LICENCIADO EN CIENCIA Y TECNOLOGÍA DE LOS ALIMENTOS,15,63,78
 ,LICENCIADO EN CIENCIAS AMBIENTALES,120,114,234
 ,LICENCIADO EN CIENCIAS Y TÉCNICAS ESTADÍSTICAS,16,17,33
 ,LICENCIADO EN FÍSICA,94,40,134
 ,LICENCIADO EN GEOLOGÍA,34,20,54
 ,LICENCIADO EN MATEMÁTICAS,53,44,97
 ,LICENCIADO EN QUÍMICA,53,69,122
TOTAL RAMA, ,2352,2383,4735
CIENCIAS SOCIALES Y JURÍDICAS,DIPLOMADO EN BIBLIOTECONOMÍA Y DOCUMENTACIÓN,5,6,11
 ,DIPLOMADO EN CIENCIAS EMPRESARIALES,149,207,356
 ,"DIPLOMADO EN CIENCIAS EMPRESARIALES ""CEUTA""",7,6,13
 ,"DIPLOMADO EN CIENCIAS EMPRESARIALES ""MELILLA""",6,6,12
 ,DIPLOMADO EN EDUCACIÓN SOCIAL,1,14,15
 ,"DIPLOMADO EN GESTIÓN Y ADMINISTRACIÓN PÚBLICA ""MELILLA""",,2,2
 ,DIPLOMADO EN RELACIONES LABORALES,136,236,372
 ,"DIPLOMADO EN RELACIONES LABORALES ""MELILLA""",,1,1
 ,DIPLOMADO EN TRABAJO SOCIAL,18,28,46
 ,DIPLOMADO EN TURISMO,19,63,82
 ,"DIPLOMATURA DE RELACIONES LABORALES ""MELILLA""",1,,1
 ,GRADUADO EN ADMINISTRACIÓN Y DIRECCIÓN DE EMPRESAS (MELILLA),142,116,258
 ,GRADUADO/A EN ADMINISTRACIÓN Y DIRECCIÓN DE EMPRESAS,669,672,1341
 ,GRADUADO/A EN ADMINISTRACIÓN Y DIRECCIÓN DE EMPRESAS (CEUTA),107,94,201
 ,GRADUADO/A EN ADMINISTRACIÓN Y DIRECCIÓN DE EMPRESAS-DERECHO,212,316,528
 ,GRADUADO/A EN ANTROPOLOGÍA SOCIAL Y CULTURAL,98,90,188
 ,GRADUADO/A EN CIENCIAS DE LA ACTIVIDAD FÍSICA Y DEL DEPORTE,627,163,790
 ,GRADUADO/A EN CIENCIAS POLÍTICAS Y DE LA ADMINIST. Y DERECHO,208,225,433
 ,GRADUADO/A EN CIENCIAS POLÍTICAS Y DE LA ADMINISTRACIÓN,397,159,556
 ,GRADUADO/A EN COMUNICACIÓN AUDIOVISUAL,147,137,284
 ,GRADUADO/A EN CRIMINOLOGÍA,56,102,158
 ,GRADUADO/A EN DERECHO,967,1074,2041
 ,GRADUADO/A EN ECONOMÍA,584,426,1010
 ,GRADUADO/A EN EDUCACIÓN INFANTIL,73,1118,1191
 ,GRADUADO/A EN EDUCACIÓN INFANTIL (CEUTA),18,159,177
 ,GRADUADO/A EN EDUCACIÓN INFANTIL (LA INMACULADA),36,363,399
 ,GRADUADO/A EN EDUCACIÓN INFANTIL (MELILLA),9,98,107
 ,GRADUADO/A EN EDUCACIÓN PRIMARIA,988,1281,2269
 ,GRADUADO/A EN EDUCACIÓN PRIMARIA (BILINGÜE),47,158,205
 ,GRADUADO/A EN EDUCACIÓN PRIMARIA (CEUTA),99,140,239
 ,GRADUADO/A EN EDUCACIÓN PRIMARIA (LA INMACULADA),297,342,639
 ,GRADUADO/A EN EDUCACIÓN PRIMARIA (MELILLA),77,116,193
 ,GRADUADO/A EN EDUCACIÓN SOCIAL,130,396,526
 ,GRADUADO/A EN EDUCACIÓN SOCIAL (CEUTA),35,117,152
 ,GRADUADO/A EN EDUCACIÓN SOCIAL (MELILLA),27,115,142
 ,GRADUADO/A EN FINANZAS Y CONTABILIDAD,255,270,525
 ,GRADUADO/A EN GEOGRAFÍA Y GESTIÓN DEL TERRITORIO,155,44,199
 ,GRADUADO/A EN GESTIÓN Y ADMINISTRACIÓN PÚBLICA (MELILLA),20,17,37
 ,GRADUADO/A EN INFORMACIÓN Y DOCUMENTACIÓN,101,172,273
 ,GRADUADO/A EN MARKETING E INVESTIGACIÓN DE MERCADOS,257,239,496
 ,GRADUADO/A EN PEDAGOGÍA,96,362,458
 ,GRADUADO/A EN RELACIONES LABORALES Y RECURSOS HUMANOS,523,727,1250
 ,GRADUADO/A EN RELACIONES LABORALES Y RECURSOS HUMANOS (MEL.),33,58,91
 ,GRADUADO/A EN SOCIOLOGÍA,249,267,516
 ,GRADUADO/A EN TRABAJO SOCIAL,168,544,712
 ,GRADUADO/A EN TURISMO,213,385,598
 ,LDO. EN ADMINISTRACIÓN Y DIRECCIÓN DE EMPRESAS Y DERECHO,137,253,390
 ,LICENCIADO EN ADMINISTRACIÓN Y DIRECCIÓN DE EMPRESAS,300,423,723
 ,LICENCIADO EN CIENCIAS DE LA ACTIVIDAD FÍSICA Y DEL DEPORTE,344,84,428
 ,LICENCIADO EN CIENCIAS DEL TRABAJO,62,152,214
 ,LICENCIADO EN CIENCIAS POLÍTICAS Y DE LA ADMINISTRACIÓN,92,82,174
 ,LICENCIADO EN CIENCIAS POLÍTICAS Y DE LA ADMON. Y DERECHO,76,112,188
 ,LICENCIADO EN COMUNICACIÓN AUDIOVISUAL,8,7,15
 ,LICENCIADO EN DERECHO,573,719,1292
 ,LICENCIADO EN DOCUMENTACIÓN,33,72,105
 ,LICENCIADO EN ECONOMÍA,230,265,495
 ,LICENCIADO EN INVESTIGACIÓN Y TÉCNICAS DE MERCADO,18,18,36
 ,LICENCIADO EN PEDAGOGÍA,62,235,297
 ,LICENCIADO EN PSICOLOGÍA,110,405,515
 ,LICENCIADO EN PSICOPEDAGOGÍA,36,82,118
 ,"LICENCIADO EN PSICOPEDAGOGÍA ""CEUTA""",5,10,15
 ,"LICENCIADO EN PSICOPEDAGOGÍA ""MELILLA""",12,32,44
 ,LICENCIADO EN SOCIOLOGÍA,61,82,143
 ,LICENCIATURA EN DERECHO,,1,1
 ,MAESTRO ESPECIALIDAD DE AUDICIÓN Y LENGUAJE,,2,2
 ,MAESTRO ESPECIALIDAD DE AUDICIÓN Y LENGUAJE,2,16,18
 ,"MAESTRO ESPECIALIDAD DE AUDICIÓN Y LENGUAJE ""CEUTA""",,4,4
 ,"MAESTRO ESPECIALIDAD DE AUDICIÓN Y LENGUAJE ""MELILLA""",,1,1
 ,MAESTRO ESPECIALIDAD DE EDUCACIÓN ESPECIAL,2,3,5
 ,MAESTRO ESPECIALIDAD DE EDUCACIÓN ESPECIAL,2,10,12
 ,"MAESTRO ESPECIALIDAD DE EDUCACIÓN ESPECIAL ""CEUTA""",2,7,9
 ,"MAESTRO ESPECIALIDAD DE EDUCACIÓN ESPECIAL ""MELILLA""",,5,5
 ,MAESTRO ESPECIALIDAD DE EDUCACIÓN FÍSICA,11,2,13
 ,MAESTRO ESPECIALIDAD DE EDUCACIÓN FÍSICA,20,11,31
 ,"MAESTRO ESPECIALIDAD DE EDUCACIÓN FÍSICA ""CEUTA""",20,8,28
 ,"MAESTRO ESPECIALIDAD DE EDUCACIÓN FÍSICA ""MELILLA""",10,3,13
 ,MAESTRO ESPECIALIDAD DE EDUCACIÓN INFANTIL,3,25,28
 ,MAESTRO ESPECIALIDAD DE EDUCACIÓN INFANTIL,2,6,8
 ,"MAESTRO ESPECIALIDAD DE EDUCACIÓN INFANTIL ""CEUTA""",2,15,17
 ,"MAESTRO ESPECIALIDAD DE EDUCACIÓN INFANTIL ""MELILLA""",,10,10
 ,MAESTRO ESPECIALIDAD DE EDUCACIÓN MUSICAL,4,,4
 ,MAESTRO ESPECIALIDAD DE EDUCACIÓN MUSICAL,18,16,34
 ,"MAESTRO ESPECIALIDAD DE EDUCACIÓN MUSICAL ""CEUTA""",2,2,4
 ,"MAESTRO ESPECIALIDAD DE EDUCACIÓN MUSICAL ""MELILLA""",1,,1
 ,MAESTRO ESPECIALIDAD DE EDUCACIÓN PRIMARIA,1,3,4
 ,MAESTRO ESPECIALIDAD DE EDUCACIÓN PRIMARIA,23,38,61
 ,"MAESTRO ESPECIALIDAD DE EDUCACIÓN PRIMARIA ""CEUTA""",1,12,13
 ,"MAESTRO ESPECIALIDAD DE EDUCACIÓN PRIMARIA ""MELILLA""",5,24,29
 ,MAESTRO ESPECIALIDAD DE LENGUA EXTRANJERA,4,2,6
 ,MAESTRO ESPECIALIDAD DE LENGUA EXTRANJERA,19,26,45
 ,"MAESTRO ESPECIALIDAD DE LENGUA EXTRANJERA ""CEUTA""",,3,3
 ,"MAESTRO ESPECIALIDAD DE LENGUA EXTRANJERA ""MELILLA""",2,3,5
TOTAL RAMA, ,10777,14922,25699
INGENIERÍA Y ARQUITECTURA,ARQUITECTO,526,417,943
 ,ARQUITECTURA TÉCNICA,347,171,518
 ,GRADUADO/A EN ARQUITECTURA,393,250,643
 ,GRADUADO/A EN EDIFICACIÓN,862,406,1268
 ,GRADUADO/A EN INGENIERÍA CIVIL,653,230,883
 ,GRADUADO/A EN INGENIERÍA DE TECNOLOGÍAS DE TELECOMUNICACIÓN,356,73,429
 ,GRADUADO/A EN INGENIERÍA ELECTRÓNICA INDUSTRIAL,150,26,176
 ,GRADUADO/A EN INGENIERÍA INFORMÁTICA,956,93,1049
 ,GRADUADO/A EN INGENIERÍA INFORMÁTICA (CEUTA),37,7,44
 ,GRADUADO/A EN INGENIERÍA INFORMÁTICA Y MATEMÁTICAS,79,30,109
 ,GRADUADO/A EN INGENIERÍA QUÍMICA,206,147,353
 ,INGENIERO DE TELECOMUNICACIÓN,189,51,240
 ,INGENIERO EN ELECTRÓNICA,70,6,76
 ,INGENIERO EN INFORMÁTICA,221,27,248
 ,INGENIERO QUÍMICO,133,140,273
 ,INGENIERO TÉCNICO EN INFORMÁTICA DE GESTIÓN,57,18,75
 ,"INGENIERO TÉCNICO EN INFORMÁTICA DE GESTIÓN ""CEUTA""",6,1,7
 ,INGENIERO TÉCNICO EN INFORMÁTICA DE SISTEMAS,50,7,57
 ,"INGENIERO/A DE CAMINOS, CANALES Y PUERTOS",487,201,688
TOTAL RAMA, ,5778,2301,8079
CIENCIAS DE LA SALUD,DIPLOMADO EN ENFERMERÍA,2,5,7
 ,"DIPLOMADO EN ENFERMERÍA ""CEUTA""",9,19,28
 ,"DIPLOMADO EN ENFERMERÍA ""MELILLA""",4,6,10
 ,DIPLOMADO EN FISIOTERAPIA,5,3,8
 ,DIPLOMADO EN LOGOPEDIA,1,12,13
 ,DIPLOMADO EN TERAPIA OCUPACIONAL,3,3,6
 ,GRADUADO/A EN ENFERMERÍA,158,513,671
 ,GRADUADO/A EN ENFERMERÍA (CEUTA),125,330,455
 ,GRADUADO/A EN ENFERMERÍA (MELILLA),78,201,279
 ,GRADUADO/A EN ENFERMERÍA (VIRGEN DE LA NIEVES),36,82,118
 ,GRADUADO/A EN FARMACIA,502,920,1422
 ,GRADUADO/A EN FISIOTERAPIA,114,113,227
 ,GRADUADO/A EN LOGOPEDIA,37,212,249
 ,GRADUADO/A EN MEDICINA,392,634,1026
 ,GRADUADO/A EN NUTRICIÓN HUMANA Y DIETÉTICA,107,274,381
 ,GRADUADO/A EN ODONTOLOGÍA,134,201,335
 ,GRADUADO/A EN PSICOLOGÍA,435,866,1301
 ,GRADUADO/A EN TERAPIA OCUPACIONAL,52,172,224
 ,LICENCIADO EN FARMACIA,267,629,896
 ,LICENCIADO EN MEDICINA,292,405,697
 ,LICENCIADO EN ODONTOLOGÍA,38,75,113
 ,LICENCIATURA EN FARMACIA,,1,1
TOTAL RAMA, ,2791,5676,8467
